{
  "id": "event-2026-04-19-business-meeting",
  "title": "Business Meeting",
  "date": "2026-04-19",
  "description": "There will be a business meeting following the evening service. Please plan on attending.",
  "location": "Victory Baptist Church - 295 Pleasant View Drive, Kittanning, PA 16201",
  "category": "meeting"
}
