{
  "id": "event-2026-08-18-breakfast-club",
  "title": "Breakfast at Bob Evans Harmar",
  "date": "2026-08-18",
  "time": "8:15 AM",
  "description": "Rise and shine! Join us at the church for some great fellowship, laughter and the most important meal of the day...breakfast! We'll be heading to Bob Evans. We will be meeting at the church at 8:15AM to carpool together. Come hungry, bring a smile, and leave the cooking to Bob Evans \"down on the farm!\"",
  "location": "1 Mariner Ct, Blawnox, PA 15238",
  "category": "fellowship",
  "contactName": "Pastor Leo",
  "contactPhone": "(724) 548-1943"
}
