{
  "id": "event-2026-11-13-ladies-bible-study",
  "title": "Ladies Bible Study",
  "date": "2026-11-13",
  "time": "6:00 PM",
  "description": "Join Mrs. Leann for an encouraging evening of God's Word, craft and fellowship. We will meet at Pastor and Mrs. Leann's home, hope to see you there!",
  "location": "1748 Freeport Road Kittanning, PA 16201",
  "category": "study"
}
