{
  "id": "event-2026-10-25-doc-bday",
  "title": "Dr. Lemon's 80th Birthday!",
  "date": "2026-10-25",
  "description": "Our church family has something special to celebrate! Following the morning service, we'll gather in the Fellowship Hall for cake in honor of Dr. Lemon's 80th birthday. Let's fill the Fellowship Hall and let Dr. Lemon known how much he is loved and appreciated.",
  "location": "Victory Baptist Church - 295 Pleasant View Drive, Kittanning, PA 16201",
  "category": "special",
  "contactName": "Pastor Leo",
  "contactPhone": "(724) 548-1943"
}
