{
  "id": "event-2026-03-07-work-day",
  "title": "Spring Work Day",
  "date": "2026-03-07",
  "time": "9:00 AM",
  "description": "Church family, we're gearing up for a big Spring Workday. We'll be painting the church auditorium and foyer and building a new retaining wall outside. Let's work together, enjoy some fellowship, and take care of God's house as a family.",
  "location": "Victory Baptist Church - 295 Pleasant View Drive, Kittanning, PA 16201",
  "category": "fellowship",
  "contactName": "Pastor Leo",
  "contactPhone": "(724) 548-1943",
  "photos": [
    "/assets/images/2026-03-07/1.jpg",
    "/assets/images/2026-03-07/2.jpg",
    "/assets/images/2026-03-07/3.jpg",
    "/assets/images/2026-03-07/4.jpg",
    "/assets/images/2026-03-07/5.jpg",
    "/assets/images/2026-03-07/6.jpg",
    "/assets/images/2026-03-07/7.jpg",
    "/assets/images/2026-03-07/8.jpg",
    "/assets/images/2026-03-07/9.jpg",
    "/assets/images/2026-03-07/10.jpg",
    "/assets/images/2026-03-07/11.jpg",
    "/assets/images/2026-03-07/12.jpg",
    "/assets/images/2026-03-07/13.jpg",
    "/assets/images/2026-03-07/14.jpg",
    "/assets/images/2026-03-07/15.jpg",
    "/assets/images/2026-03-07/16.jpg",
    "/assets/images/2026-03-07/17.jpg",
    "/assets/images/2026-03-07/18.jpg",
    "/assets/images/2026-03-07/19.jpg",
    "/assets/images/2026-03-07/20.jpg",
    "/assets/images/2026-03-07/21.jpg",
    "/assets/images/2026-03-07/22.jpg",
    "/assets/images/2026-03-07/23.jpg",
    "/assets/images/2026-03-07/24.jpg",
    "/assets/images/2026-03-07/25.jpg"
  ]
}
