{
  "id": "event-2026-05-12-breakfast-club",
  "title": "Breakfast at Crystal's Restaurant",
  "date": "2026-05-12",
  "time": "8:30 AM",
  "description": "Join us for breakfast at Crystal's Restaurant on Tuesday morning! This is a great opportunity to fellowship and enjoy a meal together. All are welcome! Bring a friend!",
  "location": "134 S Grant Ave, Kittanning, PA 16201",
  "category": "fellowship"
}
