{
  "id": "event-2026-04-24-ladies-meeting",
  "title": "Ladies Meeting",
  "date": "2026-04-24",
  "description": "Francine Taylor will be bringing an encouraging message at an upcoming Ladies Meeting! Cost is $20 for one day or $35 for both. A sign-up sheet is in the back of the sanctuary.",
  "location": "Victory Baptist Church - 295 Pleasant View Drive, Kittanning, PA 16201",
  "category": "special",
  "contactName": "Pastor Leo",
  "contactPhone": "(724) 548-1943"
}
