{
  "id": "event-2026-11-10-breakfast",
  "title": "Breakfast at Carlesi's",
  "date": "2026-11-10",
  "time": "8:30 AM",
  "description": "Join us for breakfast at Carlesi's on Tuesday morning! They say breakfast is the most important meal of the day. We say it's even better when shared with good friends! Everyone is welcome and we hope to see you there!",
  "location": "15146 US-422, Worthington, PA 16262",
  "category": "fellowship"
}
