{
  "id": "event-2026-03-06-work-day-prep",
  "title": "Prepare for Spring Work Day",
  "date": "2026-03-06",
  "time": "6:00 PM",
  "description": "Church family, we are looking for help to prepare the church for our work day on Saturday. If you are able to lend a helping hand we will be moving things, taping, etc. for painting activities the following morning!",
  "location": "Victory Baptist Church - 295 Pleasant View Drive, Kittanning, PA 16201",
  "category": "fellowship",
  "contactName": "Pastor Leo",
  "contactPhone": "(724) 548-1943"
}
