{
  "id": "event-2026-09-19-work-day",
  "title": "Work Day",
  "date": "2026-09-19",
  "time": "9:00 AM",
  "description": "Please mark this on your calendar. We have several projects planned, including painting, installing a baby changing station, cleaning and organizing the property, preparing the trailer for sale, and getting classrooms ready for use. We could use all hands on deck so please come out and help if you are able. Thank you!",
  "location": "Victory Baptist Church - 295 Pleasant View Drive, Kittanning, PA 16201",
  "category": "fellowship",
  "contactName": "Pastor Leo",
  "contactPhone": "(724) 548-1943"
}
