{
  "id": "event-2026-04-05-sunrise-service",
  "title": "Easter Sunday Sunrise Service",
  "date": "2026-04-05",
  "time": "8:45 AM",
  "description": "Come celebrate the resurrection of our Savior! Join us for a special sunrise service (outside weather permitting) with coffee, iced coffee and donuts being served following the service! Followed by morning worship at 10:45 AM. An Easter egg hunt for the children will follow immediately after the service.",
  "location": "Victory Baptist Church - 295 Pleasant View Drive, Kittanning, PA 16201",
  "category": "service",
  "contactName": "Pastor Leo",
  "contactPhone": "(724) 548-1943"
}
