{
  "id": "event-2026-09-17-breakfast",
  "title": "Breakfast at Pampeno's",
  "date": "2026-09-17",
  "time": "8:30 AM",
  "description": "Join us for breakfast at Pampeno's on Thursday morning! They say breakfast is the most important meal of the day. We say it's even better when shared with good friends! Everyone is welcome and we hope to see you there!",
  "location": "900 5th Ave, Ford City, PA 16226",
  "category": "fellowship"
}
