{
  "id": "event-2026-03-15-family-friends-day",
  "title": "Family and Friends Day",
  "date": "2026-03-15",
  "description": "We're excited to celebrate Family and Friends Day on Sunday, March 15th! After the morning service, we'll enjoy a delicious meal together, so start inviting your friends, neighbors and loved ones to join us.",
  "location": "Victory Baptist Church - 295 Pleasant View Drive, Kittanning, PA 16201",
  "category": "fellowship",
  "contactName": "Pastor Leo",
  "contactPhone": "(724) 548-1943"
}
