{
  "id": "event-2026-09-06-labor-day-potluck",
  "title": "Labor Day Weekend Potluck",
  "date": "2026-09-06",
  "description": "Join us for our church potluck on Sunday, September 6th after morning service. Bring a favorite dish and enjoy food and fellowship with our church family. Please sign up on the sheet in the back. We look forward to seeing you there!",
  "location": "Victory Baptist Church - 295 Pleasant View Drive, Kittanning, PA 16201",
  "category": "fellowship",
  "contactName": "Pastor Leo",
  "contactPhone": "(724) 548-1943"
}
