{
  "id": "event-2026-05-17-cookout",
  "title": "Cookout on the Grounds",
  "date": "2026-05-17",
  "time": "6:00 PM",
  "description": "Join us Sunday evening for a fun-filled cookout on the grounds! Come ready for a great time of food, fellowship, games and preaching!",
  "location": "Victory Baptist Church - 295 Pleasant View Drive, Kittanning, PA 16201",
  "category": "fellowship"
}
