{
  "id": "event-2026-05-10-mothers-day",
  "title": "Mother's Day at Church",
  "date": "2026-05-10",
  "description": "Join us as we celebrate and honor all mothers. A gift will be given to every mother who attends.",
  "location": "Victory Baptist Church - 295 Pleasant View Drive, Kittanning, PA 16201",
  "category": "service"
}
